sales_item,mapped_items,GramsPerServing,Calories,Protein,Total Carbohydrate,Dietary Fiber,Total Sugars,Added Sugars,Total Fat,Saturated Fat,Trans Fat,Cholesterol,Sodium,Vitamin D (D2 + D3),Calcium,Iron,Potassium,Vitamin A,Vitamin C,HasNutrients,DietaryRestrictions,ReligiousRestrictions,method,n_candidates,sales_volume,HealthScore
COOKIE,"Vanilla Sugar Cookie, Chocolate Chip Cookie, Dough, Cookie, Ginger Twinkle",18.427175,70.0,1.0,12.0,1.0,6.0,5.0,2.0,1.0,0.0,7.0,61.0,1.0,13.0,0.0,49.0,,,1,,,median_over_topK,5,741935,189.19587126929255
CEREAL MEAL,"Cereal, Cinnamon Toasters, Malt-O-Meal, IW (Sub), Cinnamon Chex Cereal, Blueberry Chex Cereal",56.0,230.0,3.0,46.0,2.0,12.0,12.0,5.0,1.0,0.0,0.0,320.0,2.0,100.0,15.0,0.0,500.0,6.0,1,,,median_over_topK,3,573659,122.119716794774
$1.25 CHIPS,"Tortilla Chips, RF Kettle Chips Jalapeno & Cheddar Chips, Doritos Wild White Nacho Flavored Tortilla Chips",39.12231,134.0,2.0,19.5,1.5,0.0,0.0,5.5,1.0,0.0,0.0,122.0,0.0,40.0,0.0,54.5,,,0,,,median_over_topK,5,485352,202.22734422693037
MINI PANCAKES,"Mini Maple Pancakes, Blueberry Mini Pancakes, Mini Maple Waffles",85.898985,210.0,4.0,35.0,4.0,11.0,10.5,7.0,1.0,0.0,5.0,210.0,0.0,59.0,4.0,135.0,1000.0,0.0,1,,,median_over_topK,5,471214,113.72455736699371
PBJ POWER PACK ELEMENTARY,"PB&J Power Pack, Turkey Pepperoni Power Pack, Turkey & Cheese & Cracker Power Pack",120.135875,360.0,15.0,43.0,5.5,11.0,7.0,16.0,5.0,0.0,35.0,973.0,0.0,290.0,2.0,305.0,,13.0,1,,,median_over_topK,5,469482,120.1306416019888
CHEESE PIZZA ELEMENTARY,"Cheese Pizza, Cheese Pizza, Cheese Pizza",141.7475,310.0,21.5,29.5,3.0,4.5,0.0,12.0,6.0,0.0,30.0,430.0,0.5,450.0,2.5,209.0,500.0,9.0,1,,,median_over_topK,5,293071,124.44485267344216
$1.00 WATER 16.9oz,"Bottled Water, Watermelon Flavored Dried Cranberries, Cheese Sticks, Baked (Warehouse - effective 9/1)",100.0,100.0,1.0,17.0,2.0,4.0,1.0,0.0,0.0,0.0,0.0,10.0,0.0,188.0,2.0,73.5,6.0,3.0,1,,,median_over_topK,5,283261,36.13876768940307
CHICKEN TENDERS SECONDARY,"Chicken Tenders Sub, Chicken Tenders, Chicken Alfredo Pasta",141.7475,239.0,23.0,18.0,4.0,3.0,0.0,10.0,1.0,0.0,60.0,377.0,3.5,51.0,1.0,297.0,55.0,0.0,1,,,median_over_topK,5,279564,61.0439039675614
ALC LUNCH ENTREE SECONDARY,"Black Beans - salad bar entree, Chickpeas - salad bar entree, Egg and Cheese Burrito - For Lunch",125.786375,168.0,6.0,27.0,3.5,2.0,0.0,4.5,0.5,0.0,9.5,140.0,0.0,61.0,1.5,104.0,,,1,,,median_over_topK,5,242260,228.90545503800774
ALCJUICE 4OZ $.75,"Apple Juice, Orange Tangerine Juice, Berry Juice",119.918385,60.0,0.0,15.0,0.0,13.0,0.0,0.0,0.0,0.0,0.0,10.0,0.0,14.5,0.0,200.0,0.0,36.0,1,,,median_over_topK,3,234354,44.93592115562514
SPICY CHICKEN ON BUN SECONDARY,"Spicy Breaded Chicken Patty on Bun, Wrap, Spicy Chicken on 6 Inch Tortillas, Spicy Chicken Wrap",171.0,365.0,22.0,44.0,4.5,2.0,1.0,11.0,1.0,0.0,50.0,615.0,7.0,79.5,3.5,130.0,28.0,0.0,1,,,median_over_topK,5,233421,57.365959402645714
YOGURT POWER PACK ELEMENTARY,"Peach Yogurt Power Pack, Cherry Vanilla Yogurt Power Pack, Strawberry & Banana Yogurt Power Pack",203.0,320.0,14.0,51.0,3.0,16.0,10.0,7.0,4.0,0.0,25.0,392.5,4.0,499.5,2.0,300.5,0.0,0.0,1,,,median_over_topK,5,228508,37.1921071149612
PBJ POWER PACK SECONDARY,"PB&J Power Pack, Turkey Pepperoni Power Pack, Turkey & Cheese & Cracker Power Pack",120.135875,360.0,15.0,43.0,5.5,11.0,7.0,16.0,5.0,0.0,35.0,973.0,0.0,290.0,2.0,305.0,,13.0,1,,,median_over_topK,5,225054,120.1306416019888
PEPPERONI PIZZA ELEMENTARY,"Pizza, Turkey Pepperoni, Slice, Turkey Pepperoni Pizza, Turkey Pepperoni Lasagna",149.68536,336.0,21.0,30.0,3.0,6.0,1.0,13.0,5.0,0.0,35.0,569.0,0.0,443.0,2.0,260.0,450.0,7.5,1,,,median_over_topK,5,205861,110.8610627353507
CHICKEN TENDERS ELEMENTARY,"Chicken Tenders Sub, Chicken Tenders, Chicken Alfredo Pasta",141.7475,239.0,23.0,18.0,4.0,3.0,0.0,10.0,1.0,0.0,60.0,377.0,3.5,51.0,1.0,297.0,55.0,0.0,1,,,median_over_topK,5,197570,61.0439039675614
BAGEL W/CREAM CHEESE,Bagel + Cream Cheese,82.3495,240.0,7.0,37.0,1.0,5.0,1.0,7.0,4.0,0.0,20.0,400.0,0.0,62.0,2.0,10.0,0.0,0.0,2,0.0,0.0,composite_sum,2,186523,-5.449226258321154
$1.25 POPCORN,"Sweet N' Salty Popcorn, Smartfood RF White Cheddar Popcorn, Cheese Sticks, Baked (Warehouse - effective 9/1)",28.3495,215.0,9.0,21.0,3.0,5.5,5.0,7.5,3.0,0.0,14.0,351.0,0.0,360.0,2.0,60.0,6.0,6.0,1,,,median_over_topK,5,153818,34.61243254962521
CHEESE STICKS W/MARINARA SECONDARY,"Cheese Sticks, Baked (Warehouse - effective 9/1) + Penne Pasta with Marinara and Beef Meatballs",598.8203431,697.0,41.0,51.0,7.0,13.0,3.0,30.0,14.0,1.0,93.0,1299.0,0.0,661.0,5.0,469.0,0.0,0.0,2,0.0,0.0,composite_sum,2,145540,63.675881572809345
$1PRETZEL,"Tangerine Whole, Dressing, Ranch, Bulk, Lite (NEW), Turkey, Pepperoni",113.398,70.0,3.0,10.0,0.0,3.0,0.5,7.0,1.0,0.0,13.0,250.0,0.0,0.0,0.0,188.0,386.0,15.0,1,,,median_over_topK,5,142082,53.20772946859902
CHEESE PIZZA SECONDARY,Cheese Pizza,141.7475,310.0,21.5,29.5,3.0,4.5,0.0,12.0,6.0,0.0,30.0,430.0,0.5,450.0,2.5,209.0,500.0,9.0,1,,,median_over_topK,5,127824,124.44485267344216
CHEESEBURGER ELEMENTARY,"Turkey Bacon Cheeseburger, Cheeseburger, Egg and American Cheese on English Muffin",148.486375,293.0,21.0,30.0,4.0,4.0,3.0,11.0,6.0,0.0,38.0,620.0,7.0,197.0,2.0,177.0,0.0,0.0,1,,,median_over_topK,5,112668,23.252882675152506
CHEESE STIX ELEMENTARY,"Egg and American Cheese on English Muffin, Cream Cheese, Calzone, Cheese",120.135875,255.0,12.0,29.0,3.0,4.0,2.0,8.0,4.0,0.0,20.0,591.0,1.0,190.0,1.0,177.0,0.0,0.0,1,,,median_over_topK,5,111739,8.222938807680038
PUMPKIN BREAD W/ STRING CHEESE,"Turkey & Cheese on loco bread, String Cheese, Batter, Pumpkin Bread",63.0,194.0,6.0,31.0,2.0,3.0,8.5,7.0,3.0,0.0,20.0,200.0,0.0,198.0,1.0,89.0,,,1,,,median_over_topK,5,108913,200.29092578929476
ALC LUNCH ENTREE ELEMENTARY,"Black Beans - salad bar entree, Chickpeas - salad bar entree, Egg and Cheese Burrito - For Lunch",125.786375,168.0,6.0,27.0,3.5,2.0,0.0,4.5,0.5,0.0,9.5,140.0,0.0,61.0,1.5,104.0,,,1,,,median_over_topK,5,105456,228.90545503800774
NACHOS W/ CHEESE ELEMENTARY,"Nachos with Black Beans and Cheese Sauce, Quesadilla, Cheese w/ 6 Inch Tortillas, Nachos with Cheese Sauce",163.86011,439.0,16.0,48.0,3.0,5.0,0.0,20.0,8.0,0.0,10.0,679.0,,259.0,1.0,792.0,,,1,,,median_over_topK,5,95578,215.48530271574234
BLUEBERRY BREAD W/ STRING CHEESE,"Turkey & Cheese on loco bread, Blueberry Bread, String Cheese",63.0,218.0,6.0,32.0,2.0,3.0,1.0,9.0,3.0,0.0,20.0,200.0,0.0,198.0,1.0,74.0,,,1,,,median_over_topK,5,93969,214.97177685312454
ORANGE CHICKEN ELEMENTARY,"Orange Chicken, Orange Slices, Orange Sauce",117.3495,83.0,2.0,20.0,1.0,12.0,10.0,0.0,0.0,0.0,0.0,123.0,0.0,13.0,1.0,257.0,0.0,0.0,1,,,median_over_topK,5,90287,-6.344780390693046
BREADED CHICKENLESS BITES ELEMENTARY,"Chicken, Bites, Breaded, Wrap, Breaded Chicken, Spicy Breaded Chicken Patty on Bun",102.0582,210.0,17.0,15.0,1.0,0.0,0.0,11.0,1.0,0.0,40.0,534.0,1.0,13.0,2.0,194.5,7.5,0.0,1,,,median_over_topK,5,89010,28.453451698935897
MANAGERS CHOICE,"Manager's Vegetable Choice, Tangerine Whole, Pasta, Baked Penne",120.3495,213.5,17.0,23.0,2.0,10.0,2.0,7.5,1.5,0.0,48.0,494.0,0.0,38.5,2.0,373.0,772.0,30.0,1,,,median_over_topK,5,86640,150.36134966082867
PEPPERONI PIZZA SECONDARY,"Pizza, Turkey Pepperoni, Slice, Turkey Pepperoni Pizza, Turkey Pepperoni Lasagna",149.68536,336.0,21.0,30.0,3.0,6.0,1.0,13.0,5.0,0.0,35.0,569.0,0.0,443.0,2.0,260.0,450.0,7.5,1,,,median_over_topK,5,83170,110.8610627353507
CHEESEBURGER SECONDARY,"Turkey Bacon Cheeseburger, Cheeseburger, Egg and American Cheese on English Muffin",148.486375,293.0,21.0,30.0,4.0,4.0,3.0,11.0,6.0,0.0,38.0,620.0,7.0,197.0,2.0,177.0,0.0,0.0,1,,,median_over_topK,5,81734,23.252882675152506
MANAGER'S CHOICE,"Manager's Vegetable Choice, Fruit Snacks, Welch's Mixed, Lay's RF Kettle Original Chips",42.52425,60.0,1.0,15.0,2.0,12.0,0.0,0.0,0.0,0.0,0.0,2.0,0.0,42.0,0.0,188.0,772.0,30.0,0,,,median_over_topK,5,78180,133.69199475835632
EGG & CHEESE ON BISCUIT,Egg and American Cheese on English Muffin + Egg and American Cheese on Biscuit,232.24265,522.0,23.0,55.0,3.0,6.0,2.0,23.0,9.0,0.0,18.0,1202.0,2.0,406.0,3.0,624.0,0.0,0.0,2,0.0,0.0,composite_sum,2,73158,17.8078989190046
BLUEBERRY MUFFIN W/ STRING CHEESE,"Egg and American Cheese on English Muffin, Blueberry Muffin Top, String Cheese",59.53395,200.0,7.0,24.0,1.0,2.0,1.0,8.0,4.0,0.0,20.0,200.0,0.5,198.0,1.0,55.0,,,1,,,median_over_topK,5,72207,209.10985563008543
ALC MILK,"1% White Milk, Fat Free White Milk, Fat Free Chocolate Milk",226.796,110.0,9.0,13.0,0.0,12.0,0.0,0.0,0.0,0.0,5.0,130.0,3.0,310.0,0.0,410.0,155.0,0.0,1,,,median_over_topK,5,72153,63.7048238019561
SPICY CHICKEN WRAP SECONDARY,"Spicy Chicken Wrap, Wrap, Spicy Chicken on 6 Inch Tortillas, Shredded Chicken Wrap",171.0,431.0,23.0,44.0,4.0,2.0,1.0,17.0,3.0,0.0,50.0,668.0,7.0,121.0,3.0,100.0,36.0,0.0,1,,,median_over_topK,5,71526,46.58485607743117
TURKEY SAUSAGE ON BISCUIT,"Turkey Sausage Breakfast Biscuit, Turkey & Cheese on Biscuit, Egg and American Cheese on Biscuit",110.972795,272.0,12.0,28.0,2.0,3.0,2.0,15.0,6.0,0.0,37.0,488.0,0.5,160.0,2.0,403.5,7.0,0.0,1,,,median_over_topK,5,64484,8.914410691688062
CHEEZ-IT,"WG Cheez-Its Cheddar, Vending Only, Cheez-Its Crackers, Tangerine Whole",113.398,200.0,10.0,21.5,2.5,5.5,0.0,7.0,3.0,0.0,16.5,280.0,0.0,79.5,1.5,153.0,442.0,6.0,1,,,median_over_topK,5,63369,74.6259796351573
MEATBALL SUB ELEM,"Asian Meatball Sub, Beef Meatball Sub Sandwich, Beef Meatballs",218.7601706,412.0,19.0,35.0,6.0,8.0,1.0,18.0,5.0,1.0,61.0,668.0,7.0,174.0,3.0,421.0,1961.0,2.0,1,,,median_over_topK,5,61225,142.28129433144284
PASTA W/ MEATBALLS ELEMENTARY,"Penne Pasta with Marinara and Beef Meatballs, Penne Pasta with Marinara and Beef Meatballs, Pasta, Frozen, Penne",489.4203431,397.0,25.0,49.0,6.0,9.0,2.0,18.0,8.0,0.0,62.0,668.0,0.0,301.0,3.0,469.0,798.0,46.0,1,,,median_over_topK,5,60916,186.67083551284338
ASIAN VEGGIE SUB-ES,"Asian Veggie Sub, Hard Boiled Eggs, Egg and American Cheese on English Muffin",111.805775,226.0,11.0,28.0,2.0,3.0,2.0,8.0,2.0,0.0,9.0,591.0,1.0,188.0,1.0,177.0,1110.5,1.0,1,,,median_over_topK,5,59322,114.37471177409832
CHICKEN TIKKA MASALA W/ RICE,"Chicken Tikka Masala, Chicken Tikka Masala, Tikka Masala Sauce",99.22325,126.0,18.5,2.0,0.0,0.5,0.5,5.5,1.0,0.0,70.5,399.5,0.0,0.0,1.0,282.0,,,1,,,median_over_topK,5,57536,228.40338164251207
FRUIT SNACKS,"Fruit Snacks, Welch's Mixed, Mixed Dried Fruit, Assorted Whole Fruit",127.1947567,87.0,1.0,22.0,2.0,15.0,4.0,0.0,0.0,0.0,0.0,25.0,0.0,14.0,1.0,237.0,126.5,35.0,1,,,median_over_topK,5,55112,62.96959068488841
GRILLED CHEESE SANDWICH ELEMENTARY,"Grilled Cheese Sandwich, Tomato Grilled Cheese Sandwich, Sandwich, Turkey & Cheese on Sub Roll",118.0,280.0,18.0,35.0,4.0,6.0,2.5,10.0,5.0,0.0,30.0,886.0,4.0,380.0,2.0,300.0,0.0,0.0,1,,,median_over_topK,5,53815,27.859870506932197
CHICKENLESS BITES W/ ORANGE SAUCE W/RICE,Orange Chickenless Bites + Cooked  Brown Rice,337.8828333,447.0,18.0,78.0,4.0,13.0,10.0,10.0,1.0,0.0,0.0,436.0,0.0,45.0,3.0,670.0,0.0,0.0,2,0.0,0.0,composite_sum,2,52841,40.08375311009323
CHEESE QUESADILLA ELEMENTARY,"Chicken and Cheese Quesadilla, Egg & Cheese Breakfast Quesadilla, Quesadilla, Turkey Barbacoa and Cheese",137.6931766,351.0,21.0,32.0,3.0,3.0,1.0,17.0,8.0,0.0,43.0,635.0,1.0,259.0,2.0,217.0,,,1,,,median_over_topK,5,52355,219.58942441375862
ALC BREAKFAST ENTREE,"Natural Breakfast Syrup, Black Beans - salad bar entree, Chickpeas - salad bar entree",110.972795,130.0,4.0,23.0,2.0,3.0,2.0,1.0,0.0,0.0,0.0,140.0,0.0,48.0,1.0,71.0,7.0,,1,,,median_over_topK,5,45525,115.40813287042413
ALC VEGETABLE/FRUIT,"Assorted Whole Fruit, Chicken & Vegetable Dumplings, Fruit Snacks, Welch's Mixed",127.1947567,240.0,16.0,31.0,4.0,3.0,0.5,5.0,0.0,0.0,0.0,363.0,0.0,36.0,3.0,281.0,160.0,37.0,1,,,median_over_topK,5,43693,112.82982551851534
STRAWBERRY PARFAIT,"Strawberry Parfait, Strawberry Parfait Power Pack, Strawberry Parfait Power Pack w/Egg",302.260155,250.0,7.0,55.0,4.0,36.0,15.0,2.0,0.0,0.0,3.0,63.0,3.0,308.0,1.0,449.0,978.0,31.0,1,,,median_over_topK,5,41992,166.2500758407083
CHICKENLESS BITE W/ MAPLEL WAFFLE SECONDARY,"Sweet Thai Chili Chickenless Bites, BBQ Chickenless Bites, Korean BBQ Chickenless Bites",117.3495,205.0,12.0,26.0,3.0,8.0,5.0,8.0,1.0,0.0,0.0,524.0,0.0,42.0,2.0,561.0,0.0,0.0,1,,,median_over_topK,5,41683,22.477135222838527
ORANGE CHICKEN SECONDARY,"Orange Chicken, Orange Slices, Orange Sauce",117.3495,83.0,2.0,20.0,1.0,12.0,10.0,0.0,0.0,0.0,0.0,123.0,0.0,13.0,1.0,257.0,0.0,0.0,1,,,median_over_topK,5,36447,-6.344780390693046
BEAN & CHEESE PUPUSA-ES,Black Bean and Corn Salad + Bean and Cheese Pupusa,262.15792,390.0,18.0,55.0,8.0,2.0,0.0,11.0,3.0,0.0,15.0,550.0,0.0,274.0,2.0,419.0,0.0,0.0,2,0.0,0.0,composite_sum,2,36158,62.372950688350656
ASIAN BEEF MEATBALL SUB-ES,"Asian Meatball Sub, Beef Meatball Sub Sandwich, Asian Veggie Sub",218.7601706,412.0,19.0,35.0,6.0,8.0,4.0,16.0,4.0,1.0,48.0,802.0,7.0,174.0,3.0,421.0,1961.0,2.0,1,,,median_over_topK,5,36083,135.4552073749211
NACHOS W/ TURKEY BARBACOA & CHEESE SAUCE ES,Nachos with Turkey Barbacoa and Cheese Sauce + Nachos with Black Beans and Cheese Sauce,342.2581562,874.0,33.0,98.0,7.0,8.0,0.0,38.0,11.0,0.0,44.0,1456.0,0.0,396.0,2.0,921.0,0.0,0.0,2,0.0,0.0,composite_sum,2,35887,33.02422949377521
MANDARIN PARFAIT,"Mandarin Orange Parfait, Mandarin  Parfait Power Pack, Peach Parfait",334.01349,258.0,7.0,56.0,3.0,36.0,16.0,2.0,0.0,0.0,3.0,63.0,3.0,308.0,2.0,478.0,1696.0,68.0,1,,,median_over_topK,5,33453,208.90218483660226
PASTA W/MEATBALLS SECODNARY,"Pasta, Baked Penne + Penne Pasta with Marinara and Beef Meatballs",1490.321186,1123.0,66.0,108.0,15.0,32.0,4.0,48.0,22.0,1.0,124.0,1793.0,0.0,1325.0,8.0,1762.0,0.0,0.0,2,0.0,0.0,composite_sum,2,32349,135.450968617968
SIMPLY CHEX,"Cinnamon Chex Cereal, Blueberry Chex Cereal, Strawberry Chex Mix",56.0,230.0,3.0,46.0,2.0,12.0,12.0,5.0,1.0,0.0,0.0,320.0,2.0,100.0,14.0,0.0,500.0,6.0,1,,,median_over_topK,3,28761,116.56416123921846
NACHOS W/CHEESE-SECON DARY,Make Your Own Nachos + Egg and American Cheese on English Muffin,243.914445,524.0,26.0,52.0,3.0,10.0,0.0,24.0,9.0,0.0,19.0,1448.0,1.0,580.0,1.0,889.0,0.0,0.0,2,0.0,0.0,composite_sum,2,28275,25.545788021371038
ALFREDO LASAGNA-ES,"Alfredo & Basil Lasagna, Turkey Pepperoni Lasagna, Broccoli Alfredo Penne - ALC",199.507414,339.5,22.5,35.0,2.5,7.0,0.5,9.5,4.0,0.0,40.0,501.0,0.0,328.0,1.5,265.5,402.0,6.0,1,,,median_over_topK,5,25550,103.2557542186784
FISH TACOS ON TORTILLA-ES,"Bean Street Tacos on Flour Tortillas, Soft Beef Taco on Flour Tortilla, Turkey Barbacoa Tacos on Flour Tortillas",180.4443055,330.0,19.0,43.0,5.0,2.0,2.0,12.0,4.0,0.0,45.0,630.0,1.0,61.0,3.0,212.0,,,1,,,median_over_topK,5,25088,228.94055087194968
TURKEY & CHEESE ON BISCUIT,Turkey Barbacoa + Egg and American Cheese on Biscuit,204.351395,396.0,24.0,33.0,2.0,4.0,2.0,19.0,8.0,0.0,59.0,1091.0,1.0,218.0,3.0,460.0,0.0,0.0,2,0.0,0.0,composite_sum,2,25083,9.22541980797007
NACHOS W/TACO MEAT&CHEESE-SEC ONDARY,"Make Your Own Nachos + Beef, Taco Meat, Pre-Cooked + Egg and American Cheese on English Muffin",333.78236,637.0,39.0,57.0,5.0,12.0,0.0,29.0,11.0,0.0,53.0,1744.0,1.0,626.0,3.0,1711.0,0.0,0.0,3,0.0,0.0,composite_sum,3,24871,68.33918461563428
CHICKEN DUMPLING SECONDARY,"Chicken Alfredo Pasta, Korean Chicken Drumstick, Chicken, Wings, Pre-Cooked",141.7475,240.0,24.0,16.0,1.0,5.0,0.0,8.0,1.0,0.0,83.0,377.0,0.0,35.0,2.0,305.0,156.0,1.0,1,,,median_over_topK,5,22608,72.15141259301149
SANDWICH (SEC),"Crispy Chicken Sandwich, Peanut Butter and Jelly Sandwich, IW, Turkey Bacon, Egg & Cheese Bagel Sandwich",113.52425,280.0,16.0,32.0,4.0,4.0,3.0,10.0,3.0,0.0,28.0,610.0,7.0,181.0,1.0,226.0,0.0,0.0,1,,,median_over_topK,5,22546,22.074328471621428
SALAD BAR ELEMENTARY,"Black Beans - salad bar entree, Chickpeas - salad bar entree, Lettuce, Green Salad Mix",130.0,80.0,4.0,14.0,4.0,1.0,0.0,1.0,0.0,0.0,0.0,140.0,0.0,27.0,1.0,97.0,344.0,2.0,1,,,median_over_topK,5,22506,63.27576430580472
ORANGE CHICKENLESS BITE SECONDARY,"Orange Chickenless Bites, Mandarin Orange Parfait, Orange Slices",117.3495,83.0,2.0,20.0,3.0,13.5,10.0,0.0,0.0,0.0,0.0,63.0,0.0,40.0,1.0,257.0,252.0,13.0,1,,,median_over_topK,5,22425,46.04844067758523
YOGURT POWER PACK SECONDARY,"Peach Yogurt Power Pack, Cherry Vanilla Yogurt Power Pack, Strawberry & Banana Yogurt Power Pack",203.0,320.0,14.0,51.0,3.0,16.0,10.0,7.0,4.0,0.0,25.0,392.5,4.0,499.5,2.0,300.5,0.0,0.0,1,,,median_over_topK,5,21252,37.1921071149612
CHICKEN & CHEESE QUESADILLA SECONDARY,Chicken Alfredo Pasta + Chicken and Cheese Quesadilla,762.3960616,659.0,45.0,77.0,7.0,8.0,1.0,20.0,7.0,0.0,91.0,1012.0,0.0,438.0,4.0,610.0,0.0,0.0,2,0.0,0.0,composite_sum,2,20833,104.14039290688592
BBQ CHICKEN SANDWICH ELEMENTARY,"BBQ Chicken Sandwich, Crispy Chicken Sandwich, Chicken Philly Sandwich",151.3689,331.0,24.0,41.0,4.0,11.0,3.0,11.0,2.0,0.0,54.0,610.0,7.0,122.0,2.0,360.0,18.0,321.0,1,,,median_over_topK,5,19283,150.33379066632878
TRIPLE BERRY PARFAIT,"Parfait, Triple Berry, Triple Berry Parfait Power Pack, Mandarin Orange Parfait",218.064035,220.0,6.0,46.0,4.0,26.0,15.0,2.0,0.0,0.0,3.0,53.0,3.0,296.0,1.0,323.0,1696.0,22.0,1,,,median_over_topK,5,18500,150.90701741901898
FIELD TRIP LUNCH ELEMENTARY,"Egg and Cheese Burrito - For Lunch, Frozen Berry, Triple Berry Blend, Red Pepper Strips",125.786375,216.0,6.0,31.0,3.0,7.0,7.5,2.0,0.0,0.0,3.0,53.0,1.0,138.0,1.0,137.0,994.0,13.0,1,,,median_over_topK,5,17972,137.16414550929377
BISCUIT & JELLY,"Turkey Sausage Breakfast Biscuit + Peanut Butter and Jelly Sandwich, IW",184.681495,597.0,21.0,60.0,6.0,17.0,14.0,33.0,10.0,0.0,37.0,768.0,0.0,146.0,3.0,360.0,7.0,0.0,2,0.0,0.0,composite_sum,2,17454,-13.614868607273308
TURKEY BARBACOA AREPAS W/ CHEESE ES,"Nachos with Turkey Barbacoa and Cheese Sauce, Quesadilla, Turkey Barbacoa and Cheese, Turkey Barbacoa & Cheese Taco",164.7669375,322.0,24.0,32.0,3.0,4.0,1.0,11.0,3.0,0.0,39.0,870.0,4.0,190.0,2.0,315.0,,,1,,,median_over_topK,5,16774,237.671186315132
STRING CHEESE,"String Cheese, Cheese, String, Mozzarella, Low-Fat IW, Egg and American Cheese on English Muffin",111.805775,216.0,12.0,24.0,1.0,2.0,0.0,6.0,2.0,0.0,20.0,441.0,1.0,198.0,1.0,177.0,0.0,0.0,1,,,median_over_topK,5,16609,24.096904658762593
SALAD BAR SECONDARY,"Black Beans - salad bar entree, Chickpeas - salad bar entree, Lettuce, Green Salad Mix",130.0,80.0,4.0,14.0,4.0,1.0,0.0,1.0,0.0,0.0,0.0,140.0,0.0,27.0,1.0,97.0,344.0,2.0,1,,,median_over_topK,5,16411,63.27576430580472
CHEESE QUESADILLA SECONDARY,"Chicken and Cheese Quesadilla, Egg & Cheese Breakfast Quesadilla, Quesadilla, Turkey Barbacoa and Cheese",137.6931766,351.0,21.0,32.0,3.0,3.0,1.0,17.0,8.0,0.0,43.0,635.0,1.0,259.0,2.0,217.0,,,1,,,median_over_topK,5,15777,219.58942441375862
FISH W/ ROLL-SECONDARY,"Fish Filet Potato Encrusted, Sub Roll, Whole Wheat Dinner Roll",102.0582,202.0,14.0,27.0,4.0,2.0,2.0,10.0,2.0,0.0,45.0,293.0,1.0,48.0,1.0,374.0,0.0,0.0,1,,,median_over_topK,5,14577,31.42727801976062
MINI CHEESE CALZONE SECONDARY,"Calzone, Cheese, Egg and American Cheese on English Muffin, Cream Cheese",120.135875,255.0,12.0,29.0,3.0,4.0,2.0,8.0,4.0,0.0,20.0,591.0,1.0,190.0,1.0,177.0,0.0,0.0,1,,,median_over_topK,5,14483,8.222938807680038
CHICKEN TENDER ON BISCUIT,"Egg and American Cheese on Biscuit, Turkey & Cheese on Biscuit, Chicken & Biscuit Sandwich",113.3495,285.0,11.0,30.0,2.0,3.0,2.0,12.0,6.0,0.0,20.0,488.0,0.0,123.0,2.0,360.0,12.5,,1,,,median_over_topK,5,14187,103.57992299827346
CHICKEN ON BUN SECONDARY,"Spicy Breaded Chicken Patty on Bun, Wrap, Spicy Chicken on 6 Inch Tortillas, Chicken Masala Drumstick",141.7475,239.0,22.0,8.0,1.0,2.0,1.0,11.0,1.0,0.0,83.0,350.0,0.0,49.0,1.0,250.5,46.0,0.0,1,,,median_over_topK,5,14173,48.00595926948232
HOT TURKEY AND CHEESE SANDWICH ELEMENTARY,"Hot Turkey & Cheese + Sandwich, Turkey & Cheese on Sub Roll",243.02425,485.0,40.0,63.0,8.0,8.0,3.0,13.0,5.0,0.0,58.0,1623.0,8.0,410.0,3.0,627.0,0.0,0.0,2,0.0,0.0,composite_sum,2,13782,67.98948966381656
GRILLED CHEESE SANDWICH SECONDARY,"Grilled Cheese Sandwich, Tomato Grilled Cheese Sandwich, Sandwich, Turkey & Cheese on Sub Roll",118.0,280.0,18.0,35.0,4.0,6.0,2.5,10.0,5.0,0.0,30.0,886.0,4.0,380.0,2.0,300.0,0.0,0.0,1,,,median_over_topK,5,13442,27.859870506932197
VEGGIE DUMPLINGS SECONDARY,"Asian Veggie Sub, Hard Boiled Eggs, Egg and American Cheese on English Muffin",111.805775,226.0,11.0,28.0,2.0,3.0,2.0,8.0,2.0,0.0,9.0,591.0,1.0,188.0,1.0,177.0,1110.5,1.0,1,,,median_over_topK,5,12532,114.37471177409832
TURKEY BARBACOA QUESADILLA SECONDARY,"Quesadilla, Turkey Barbacoa and Cheese, Turkey Barbacoa, Turkey Barbacoa Tacos on Flour Tortillas",166.9786013,322.0,23.0,32.0,3.0,2.0,0.5,11.0,4.0,0.0,63.0,855.0,0.0,117.0,1.0,122.0,,,1,,,median_over_topK,5,12498,216.8721240350336
BEAN & CHEESE PUPUSA SECONDARY,Black Bean and Corn Salad + Bean and Cheese Pupusa,262.15792,390.0,18.0,55.0,8.0,2.0,0.0,11.0,3.0,0.0,15.0,550.0,0.0,274.0,2.0,419.0,0.0,0.0,2,0.0,0.0,composite_sum,2,12395,62.372950688350656
ALFREDO LASAGNA-SECONDA RY,"Alfredo & Basil Lasagna, Turkey Pepperoni Lasagna, Broccoli Alfredo Penne - ALC",199.507414,339.5,22.5,35.0,2.5,7.0,0.5,9.5,4.0,0.0,40.0,501.0,0.0,328.0,1.5,265.5,402.0,6.0,1,,,median_over_topK,5,12333,103.2557542186784
VEGAN BURGER SECONDARY,"Vegan Burger, BBQ Vegan Burger, Hamburger",134.786375,310.0,20.0,30.0,4.0,4.0,3.0,13.0,5.0,0.0,45.0,668.0,7.0,180.0,3.0,170.0,0.0,0.0,1,,,median_over_topK,5,11092,28.090940187585602
ASIAN BEEF MEATBALL SUB-SECONDARY,"Asian Meatball Sub, Beef Meatball Sub Sandwich, Asian Veggie Sub",218.7601706,412.0,19.0,35.0,6.0,8.0,4.0,16.0,4.0,1.0,48.0,802.0,7.0,174.0,3.0,421.0,1961.0,2.0,1,,,median_over_topK,5,10994,135.4552073749211
NACHOS W/TURKEY BARBACOA&CHEES E SECONDARY,Make Your Own Nachos + Turkey Barbacoa + Cheesy Fiesta Nachos,425.0367973,812.0,42.0,76.0,6.0,13.0,0.0,38.0,13.0,0.0,65.0,2025.0,0.0,593.0,3.0,1215.0,39.0,3.0,3,0.0,0.0,composite_sum,3,10770,49.85012502793313
CHANA MASALA W/ RICE,"Chana Masala, Chicken Tikka Masala, Fried Rice",132.831749,164.5,11.0,31.0,2.5,1.0,0.0,2.0,0.0,0.0,0.5,206.5,1.0,16.0,1.0,175.0,,,1,,,median_over_topK,5,10341,232.02345901876063
CHICKEN PHILLY SUB-ES,"Chicken Tenders Sub, Chicken Philly Sandwich, Korean Chicken Drumstick",175.7669,317.0,24.0,31.0,2.0,5.0,3.0,11.0,1.0,0.0,60.0,609.0,0.0,35.0,2.0,297.0,156.0,322.0,1,,,median_over_topK,5,10274,157.41471114157224
FISH FILLET SANDWISH-SECON DARY,"Fish Filet Potato Encrusted, Fish Tacos, Fish Tacos",162.0582,350.0,18.0,40.0,5.0,2.0,2.0,13.0,4.0,0.0,45.0,480.0,1.0,48.0,2.0,440.0,0.0,6.0,1,,,median_over_topK,5,10117,38.25055189980454
$0.50 Juice,"Apple Juice, Orange Tangerine Juice, Berry Juice",119.918385,60.0,0.0,15.0,0.0,13.0,0.0,0.0,0.0,0.0,0.0,10.0,0.0,14.5,0.0,200.0,0.0,36.0,1,,,median_over_topK,3,10113,44.93592115562514
ALC $1 YOGURT OZ,"Assorted  4 oz Yogurt, Peach Yogurt Power Pack, Cherry Vanilla Yogurt Power Pack",203.0,320.0,14.0,51.0,3.0,16.0,10.0,7.0,4.0,0.0,25.0,392.5,4.0,499.5,2.0,300.5,0.0,0.0,1,,,median_over_topK,5,9908,37.1921071149612
VEGAN BURGER ELEMENTARY,"Vegan Burger, BBQ Vegan Burger, Hamburger",134.786375,310.0,20.0,30.0,4.0,4.0,3.0,13.0,5.0,0.0,45.0,668.0,7.0,180.0,3.0,170.0,0.0,0.0,1,,,median_over_topK,5,9671,28.090940187585602
MEATBALL SUB SECONDARY,"Asian Meatball Sub, Beef Meatball Sub Sandwich, Beef Meatballs",218.7601706,412.0,19.0,35.0,6.0,8.0,1.0,18.0,5.0,1.0,61.0,668.0,7.0,174.0,3.0,421.0,1961.0,2.0,1,,,median_over_topK,5,9471,142.28129433144284
CHICKEN TIKKA MASALA SECONDARY,"Chicken Tikka Masala, Chicken Tikka Masala, Tikka Masala Sauce",99.22325,126.0,18.5,2.0,0.0,0.5,0.5,5.5,1.0,0.0,70.5,399.5,0.0,0.0,1.0,282.0,,,1,,,median_over_topK,5,9160,228.40338164251207
BBQ CHICKEN SANDWICH SECONDARY,"BBQ Chicken Sandwich, Crispy Chicken Sandwich, Chicken Philly Sandwich",151.3689,331.0,24.0,41.0,4.0,11.0,3.0,11.0,2.0,0.0,54.0,610.0,7.0,122.0,2.0,360.0,18.0,321.0,1,,,median_over_topK,5,8579,150.33379066632878
TACO BEEF AREPAS-ES,"Arepa w/Taco Beef, Taco Beef, Soft Beef Taco on Flour Tortilla",180.4443055,216.0,13.0,10.0,3.0,4.0,0.0,6.0,2.0,0.0,34.0,360.0,0.0,61.0,2.0,822.0,2295.0,85.0,1,,,median_over_topK,5,7651,238.2406574442701
FISH TACO ON TORTILLA-SECONDA RY,"Soft Beef Taco on Flour Tortilla, Soft Bean Taco on Flour Tortilla, Tacos, Taco Meat, Flour Tortilla",180.4443055,253.0,19.0,35.0,6.0,4.0,0.5,12.0,4.0,0.0,34.0,510.0,0.0,82.0,3.0,835.0,1914.0,10.0,1,,,median_over_topK,5,7440,165.7713359990978
CEREAL/ NO MILK,"Cinnamon Chex Cereal, Blueberry Chex Cereal",56.0,235.0,3.0,46.0,2.0,12.0,12.0,5.0,1.0,0.0,0.0,335.0,2.0,100.0,15.0,0.0,500.0,6.0,1,,,median_over_topK,2,7297,121.46754288173054
NACHOS W/TACO MEAT/CHEESE SAUCE ELEMENTARY,Make Your Own Nachos + Nachos with Taco Meat and Cheese Sauce,287.3221825,738.0,30.0,73.0,5.0,13.0,0.0,36.0,13.0,0.0,32.0,1536.0,0.0,601.0,1.0,1579.0,0.0,0.0,2,0.0,0.0,composite_sum,2,6953,31.97474681271359
CHICKEN DUMPLINGS ELEMENTARY,"Chicken & Vegetable Dumplings, Chicken & Vegetable Dumplings, Chicken Alfredo Pasta",136.0776,242.0,19.0,31.0,2.0,3.0,0.5,8.0,1.0,0.0,48.0,550.0,0.0,35.0,2.0,298.0,,0.0,1,,,median_over_topK,5,6947,136.7983065778966
HOT TURKEY AND CHEESE SANDWICH SECONDARY,"Hot Turkey & Cheese + Sandwich, Turkey & Cheese on Sub Roll",243.02425,485.0,40.0,63.0,8.0,8.0,3.0,13.0,5.0,0.0,58.0,1623.0,8.0,410.0,3.0,627.0,0.0,0.0,2,0.0,0.0,composite_sum,2,6535,67.98948966381656
ASIAN VEGGIE SUB-SECONDARY,"Asian Veggie Sub, Hard Boiled Eggs, Egg and American Cheese on English Muffin",111.805775,226.0,11.0,28.0,2.0,3.0,2.0,8.0,2.0,0.0,9.0,591.0,1.0,188.0,1.0,177.0,1110.5,1.0,1,,,median_over_topK,5,6193,114.37471177409832
BBQ CHICKEN DRUMSTICK ELEMENTARY,"BBQ Chicken Drumstick, Korean Chicken Drumstick, Chicken, Drumstick, Sweet Thai Chili",150.249149,282.0,24.0,10.0,0.0,8.0,7.0,16.0,4.0,0.0,118.0,1035.0,0.0,16.0,2.0,313.0,,,1,,,median_over_topK,5,6013,192.17536785344373
PARFAIT POWER PACK SECONDARY,"Strawberry Parfait Power Pack, Triple Berry Parfait Power Pack, Peach Parfait, Power Pack",324.260155,490.0,14.0,78.0,5.0,42.0,32.0,15.0,5.0,0.0,42.0,350.0,3.0,512.0,2.0,457.0,260.0,31.0,1,,,median_over_topK,5,5947,62.92775012556892
