sales_item,mapped_items,GramsPerServing,Calories,Protein,Total Carbohydrate,Dietary Fiber,Total Sugars,Added Sugars,Total Fat,Saturated Fat,Trans Fat,Cholesterol,Sodium,Vitamin D (D2 + D3),Calcium,Iron,Potassium,Vitamin A,Vitamin C,HasNutrients,DietaryRestrictions,ReligiousRestrictions,method,n_candidates,sales_volume,HealthScore
NACHOS W/ BLACK BEANS AND CHEESE SECONDARY,Nachos with Black Beans and Cheese Sauce + Egg and American Cheese on English Muffin,287.08533,655.0,26.0,78.0,6.0,6.0,0.0,26.0,7.0,0.0,14.0,1192.0,1.0,398.0,2.0,633.0,0.0,0.0,2,0.0,0.0,composite_sum,2,5800,40.67970669100225
PINEAPPLE PARFAIT,"Pineapple Parfait, Mandarin Orange Parfait, Peach Parfait",314.8775775,258.0,6.0,56.0,3.0,36.0,15.0,2.0,0.0,0.0,3.0,60.0,3.0,308.0,1.0,441.0,893.0,42.5,1,,,median_over_topK,5,5303,173.40480586651287
TURKEY BARBACOA AREPAS W/ CHEESE SECONDARY,"Nachos with Turkey Barbacoa and Cheese Sauce, Quesadilla, Turkey Barbacoa and Cheese, Turkey Barbacoa & Cheese Taco",164.7669375,322.0,24.0,32.0,3.0,4.0,1.0,11.0,3.0,0.0,39.0,870.0,4.0,190.0,2.0,315.0,,,1,,,median_over_topK,5,4766,237.671186315132
NACHO W/ BLACK BEANS&CHEESE SAUCE ELEMENTARY,Black Beans + Nachos with Black Beans and Cheese Sauce,303.279555,549.0,19.0,70.0,10.0,4.0,0.0,21.0,5.0,0.0,5.0,1181.0,0.0,210.0,1.0,456.0,0.0,0.0,2,0.0,0.0,composite_sum,2,4238,22.683840581790818
PARFAIT,"Mandarin Orange Parfait, Blueberry Parfait, Strawberry Parfait",218.064035,220.0,6.0,46.0,4.0,26.0,15.0,2.0,0.0,0.0,3.0,53.0,3.0,296.0,1.0,323.0,893.0,24.0,1,,,median_over_topK,5,4039,152.35146186346344
FIELD TRIP LUNCH SECONDARY,"Egg and Cheese Burrito - For Lunch, Frozen Berry, Triple Berry Blend, Red Pepper Strips",125.786375,216.0,6.0,31.0,3.0,7.0,7.5,2.0,0.0,0.0,3.0,53.0,1.0,138.0,1.0,137.0,994.0,13.0,1,,,median_over_topK,5,3378,137.16414550929377
PARFAIT POWER PACK ELEMENTARY,"Strawberry Parfait Power Pack, Triple Berry Parfait Power Pack, Peach Parfait, Power Pack",324.260155,490.0,14.0,78.0,5.0,42.0,32.0,15.0,5.0,0.0,42.0,350.0,3.0,512.0,2.0,457.0,260.0,31.0,1,,,median_over_topK,5,3287,62.92775012556892
TURKEY BARBACOA QUESADILLA ES,"Quesadilla, Turkey Barbacoa and Cheese, Turkey Barbacoa, Turkey Barbacoa Tacos on Flour Tortillas",166.9786013,322.0,23.0,32.0,3.0,2.0,0.5,11.0,4.0,0.0,63.0,855.0,0.0,117.0,1.0,122.0,,,1,,,median_over_topK,5,3141,216.8721240350336
VEGGIE DUMPLINGS ELEMENTARY,"Asian Veggie Sub, Hard Boiled Eggs, Egg and American Cheese on English Muffin",111.805775,226.0,11.0,28.0,2.0,3.0,2.0,8.0,2.0,0.0,9.0,591.0,1.0,188.0,1.0,177.0,1110.5,1.0,1,,,median_over_topK,5,3057,114.37471177409832
NUTRIGRAIN BARS -,"Tangerine Whole, Dressing, Ranch, Bulk, Lite (NEW), Turkey, Pepperoni",113.398,70.0,3.0,10.0,0.0,3.0,0.5,7.0,1.0,0.0,13.0,250.0,0.0,0.0,0.0,188.0,386.0,15.0,1,,,median_over_topK,5,2888,53.20772946859902
CHICKEN QUESADILLA ELEMENTARY,"Chicken Quesadilla, Quesadilla, Chicken & Cheese (Shred Chicken) 6 in Tortilla, Chicken and Cheese Quesadilla",135.6931766,316.0,21.0,31.0,3.0,3.0,1.0,12.0,4.0,0.0,53.0,565.0,0.0,225.0,2.0,207.0,,,1,,,median_over_topK,5,2839,239.80475210179677
BBQ CHICKEN DRUMSTICK SECONDARY,"BBQ Chicken Drumstick, Korean Chicken Drumstick, Chicken, Drumstick, Sweet Thai Chili",150.249149,282.0,24.0,10.0,0.0,8.0,7.0,16.0,4.0,0.0,118.0,1035.0,0.0,16.0,2.0,313.0,,,1,,,median_over_topK,5,2717,192.17536785344373
CHICKEN PHILLY SUB-SECONDARY,"Chicken Tenders Sub, Chicken Philly Sandwich, Korean Chicken Drumstick",175.7669,317.0,24.0,31.0,2.0,5.0,3.0,11.0,1.0,0.0,60.0,609.0,0.0,35.0,2.0,297.0,156.0,322.0,1,,,median_over_topK,5,2528,157.41471114157224
IZZE DRINK - $1.50,"IZZE, Strawberry, IZZE, Blackberry, IZZE, Clementine",238.1358,70.0,0.0,16.0,0.0,14.0,0.0,0.0,0.0,0.0,0.0,10.0,0.0,360.0,2.0,0.0,0.0,0.0,1,,,median_over_topK,5,2117,38.36863619472316
WAFFLES BREAKFAST,"Mini Maple Waffles, Natural Breakfast Syrup, Turkey Sausage Breakfast Biscuit",110.972795,237.0,12.0,32.0,4.0,7.0,4.0,5.0,1.0,0.0,0.0,464.0,0.0,75.0,2.0,150.0,503.5,,1,,,median_over_topK,5,1877,179.455634954223
CHANA MASALA SECONDARY,"Chana Masala, Chicken Tikka Masala, Tikka Masala Sauce",123.320325,101.5,18.5,5.0,0.0,1.0,0.0,2.5,0.0,0.0,50.5,361.0,0.0,16.0,1.0,202.0,,,1,,,median_over_topK,5,1411,235.6059362571851
PASTA W/MEAT SAUCE SECONDARY,"Pasta, Baked Penne + Pasta with Meat Sauce",1691.091072,917.0,48.0,115.0,14.0,25.0,3.0,31.0,14.0,0.0,61.0,1156.0,0.0,1049.0,7.0,1483.0,0.0,0.0,2,0.0,0.0,composite_sum,2,1085,161.71562376849886
PRESCHOOL LUNCH,"Egg and Cheese Burrito - For Lunch, Tangerine Whole, Vanilla Sugar Cookie",120.3495,185.0,15.0,15.0,2.0,6.0,3.5,7.0,1.0,0.0,21.0,434.0,0.0,35.0,1.0,188.0,772.0,30.0,1,,,median_over_topK,5,1034,138.3612626884938
SPECIAL DIET MEAL ELEMENTARY,"Diet Coke 24/12oz, Cereal, Cinnamon Toasters, Malt-O-Meal, IW (Sub), Tomato Basil Lasagna",153.370795,306.5,19.0,29.0,3.0,3.0,2.0,11.5,5.0,0.0,39.0,476.0,3.5,432.0,2.0,176.0,221.0,3.0,1,,,median_over_topK,5,954,75.47888257611224
MGR CHOICE SECONDARY,"Manager's Vegetable Choice, Tangerine Whole, Pasta, Baked Penne",120.3495,213.5,17.0,23.0,2.0,10.0,2.0,7.5,1.5,0.0,48.0,494.0,0.0,38.5,2.0,373.0,772.0,30.0,1,,,median_over_topK,5,847,150.36134966082867
FASTING BREAKFAST,"Natural Breakfast Syrup, Turkey Sausage Breakfast Biscuit, Egg & Cheese Breakfast Quesadilla",110.972795,297.0,12.0,28.0,2.0,3.0,2.0,10.0,5.0,0.0,21.0,464.0,0.0,120.0,2.0,206.0,224.5,6.0,1,,,median_over_topK,5,772,38.51217154939343
LACTOSE FREE MILK,"Lactose Free, White Milk, Milk, Lactose Free,  Fat Free, Shelf-Stable, Milk, Lactose Free,  Fat Free, Shelf-Stable (substitute)",226.796,90.0,9.0,13.0,0.0,12.0,0.0,0.0,0.0,0.0,5.0,130.0,3.0,310.0,0.0,400.0,155.0,0.0,1,,,median_over_topK,5,690,63.49205784450928
BURKE ALC MEAL,"Cereal, Cinnamon Toasters, Malt-O-Meal, IW (Sub), Broccoli Alfredo Penne - ALC, Cheese Pizza - ALC",56.699,60.0,10.0,24.5,2.5,8.0,0.0,0.0,0.0,0.0,14.0,4.0,0.0,237.0,1.0,182.0,607.0,18.0,1,,,median_over_topK,5,594,143.24727441602656
PREK EVENT STUDENT LUNCH,"Egg and Cheese Burrito - For Lunch, Tangerine Whole, Vanilla Sugar Cookie",120.3495,185.0,15.0,15.0,2.0,6.0,3.5,7.0,1.0,0.0,21.0,434.0,0.0,35.0,1.0,188.0,772.0,30.0,1,,,median_over_topK,5,580,138.3612626884938
FASTING LUNCH-ELEMENTAR Y,"Egg and Cheese Burrito - For Lunch, Tangerine Whole, Vanilla Sugar Cookie",120.3495,185.0,15.0,15.0,2.0,6.0,3.5,7.0,1.0,0.0,21.0,434.0,0.0,35.0,1.0,188.0,772.0,30.0,1,,,median_over_topK,5,523,138.3612626884938
FASTING LUNCH - SECONDARY,"Egg and Cheese Burrito - For Lunch, Tangerine Whole, Vanilla Sugar Cookie",120.3495,185.0,15.0,15.0,2.0,6.0,3.5,7.0,1.0,0.0,21.0,434.0,0.0,35.0,1.0,188.0,772.0,30.0,1,,,median_over_topK,5,506,138.3612626884938
BBQ BEEF RIB SECONDARY,"Penne Pasta with Marinara and Beef Meatballs, Beef, Taco Meat, Pre-Cooked, Beef Meatballs",89.867915,151.0,13.0,5.0,2.0,2.0,0.0,10.0,4.0,0.5,34.0,332.0,0.0,46.0,1.0,822.0,2676.0,160.0,1,,,median_over_topK,5,435,225.67262364740336
ALC HARD BOILED EGG,"Egg, Hard Boiled, Bulk pouch, Hard Boiled Eggs, Egg and American Cheese on English Muffin",106.135875,216.0,10.0,24.0,1.0,2.0,1.0,7.0,2.0,0.0,9.0,521.0,1.0,181.0,1.0,162.0,260.0,0.0,1,,,median_over_topK,5,417,41.532865347267226
SPECIAL DIET MEAL SECONDARY,"Diet Coke 24/12oz, Cereal, Cinnamon Toasters, Malt-O-Meal, IW (Sub), Tomato Basil Lasagna",153.370795,306.5,19.0,29.0,3.0,3.0,2.0,11.5,5.0,0.0,39.0,476.0,3.5,432.0,2.0,176.0,221.0,3.0,1,,,median_over_topK,5,399,75.47888257611224
"CHICKEN TENDERS 1,273 SECONDARY","Chicken Tenders Sub, Chicken Tenders, Buffalo Chicken Dip",141.7475,239.0,23.0,8.0,2.5,3.0,0.0,12.0,1.0,0.0,83.0,389.0,3.5,51.0,1.0,190.0,55.0,0.0,1,,,median_over_topK,5,368,54.29820067139313
"CHICKEN TENDERS 1,121 SECONDARY","Chicken Tenders Sub, Chicken Tenders, Buffalo Chicken Dip",141.7475,239.0,23.0,8.0,2.5,3.0,0.0,12.0,1.0,0.0,83.0,389.0,3.5,51.0,1.0,190.0,55.0,0.0,1,,,median_over_topK,5,321,54.29820067139313
"CHICKEN TENDERS 1,092 SECONDARY","Chicken Tenders Sub, Chicken Tenders, Buffalo Chicken Dip",141.7475,239.0,23.0,8.0,2.5,3.0,0.0,12.0,1.0,0.0,83.0,389.0,3.5,51.0,1.0,190.0,55.0,0.0,1,,,median_over_topK,5,314,54.29820067139313
"CHICKEN TENDERS 1,019 SECONDARY","Chicken Tenders Sub, Chicken Tenders, Buffalo Chicken Dip",141.7475,239.0,23.0,8.0,2.5,3.0,0.0,12.0,1.0,0.0,83.0,389.0,3.5,51.0,1.0,190.0,55.0,0.0,1,,,median_over_topK,5,312,54.29820067139313
PREK FAMILY EVENT STUDENT BREAKFAST,"Natural Breakfast Syrup, Turkey Sausage Breakfast Biscuit, Egg & Cheese Breakfast Quesadilla",110.972795,297.0,12.0,28.0,2.0,3.0,2.0,10.0,5.0,0.0,21.0,464.0,0.0,120.0,2.0,206.0,224.5,6.0,1,,,median_over_topK,5,307,38.51217154939343
"CHICKEN TENDERS 1,043 SECONDARY","Chicken Tenders Sub, Chicken Tenders, Buffalo Chicken Dip",141.7475,239.0,23.0,8.0,2.5,3.0,0.0,12.0,1.0,0.0,83.0,389.0,3.5,51.0,1.0,190.0,55.0,0.0,1,,,median_over_topK,5,288,54.29820067139313
"CHICKEN TENDERS 1,083 SECONDARY","Chicken Tenders Sub, Chicken Tenders, Buffalo Chicken Dip",141.7475,239.0,23.0,8.0,2.5,3.0,0.0,12.0,1.0,0.0,83.0,389.0,3.5,51.0,1.0,190.0,55.0,0.0,1,,,median_over_topK,5,287,54.29820067139313
"CHICKEN TENDERS 1,086 SECONDARY","Chicken Tenders Sub, Chicken Tenders, Buffalo Chicken Dip",141.7475,239.0,23.0,8.0,2.5,3.0,0.0,12.0,1.0,0.0,83.0,389.0,3.5,51.0,1.0,190.0,55.0,0.0,1,,,median_over_topK,5,272,54.29820067139313
THANKSGIVING LUNCH ELEMENTARY,"Egg and Cheese Burrito - For Lunch, Tangerine Whole, Vanilla Sugar Cookie",120.3495,185.0,15.0,15.0,2.0,6.0,3.5,7.0,1.0,0.0,21.0,434.0,0.0,35.0,1.0,188.0,772.0,30.0,1,,,median_over_topK,5,223,138.3612626884938
PREK FAMILY EVENT ADULT BREAKFAST CHARGED FROM FSO,"Natural Breakfast Syrup, Turkey Sausage Breakfast Biscuit, Egg & Cheese Breakfast Quesadilla",110.972795,297.0,12.0,28.0,2.0,3.0,2.0,10.0,5.0,0.0,21.0,464.0,0.0,120.0,2.0,206.0,224.5,6.0,1,,,median_over_topK,5,156,38.51217154939343
CENTER LUNCH - PUREED,"Egg and Cheese Burrito - For Lunch, Tangerine Whole, Vanilla Sugar Cookie",120.3495,185.0,15.0,15.0,2.0,6.0,3.5,7.0,1.0,0.0,21.0,434.0,0.0,35.0,1.0,188.0,772.0,30.0,1,,,median_over_topK,5,122,138.3612626884938
PREK FAMILY EVENT ADULT LUNCH,"Egg and Cheese Burrito - For Lunch, Tangerine Whole, Vanilla Sugar Cookie",120.3495,185.0,15.0,15.0,2.0,6.0,3.5,7.0,1.0,0.0,21.0,434.0,0.0,35.0,1.0,188.0,772.0,30.0,1,,,median_over_topK,5,108,138.3612626884938
PREK FAMILY EVENT ALC,"Broccoli Alfredo Penne - ALC, Cheese Pizza - ALC, Tangerine Whole",19.0,60.0,3.0,10.0,0.0,8.0,3.5,2.0,1.0,0.0,13.0,165.0,0.0,0.0,0.0,188.0,772.0,30.0,1,,,median_over_topK,5,76,110.45893719806763
THANKSGIVING LUNCH SECONDARY,"Egg and Cheese Burrito - For Lunch, Tangerine Whole, Vanilla Sugar Cookie",120.3495,185.0,15.0,15.0,2.0,6.0,3.5,7.0,1.0,0.0,21.0,434.0,0.0,35.0,1.0,188.0,772.0,30.0,1,,,median_over_topK,5,56,138.3612626884938
CENTER BREAKFAST PUREED,"Natural Breakfast Syrup, Turkey Sausage Breakfast Biscuit, Egg & Cheese Breakfast Quesadilla",110.972795,297.0,12.0,28.0,2.0,3.0,2.0,10.0,5.0,0.0,21.0,464.0,0.0,120.0,2.0,206.0,224.5,6.0,1,,,median_over_topK,5,53,38.51217154939343
No Charge A La Carte Promotion,"Tangerine Whole, Dressing, Ranch, Bulk, Lite (NEW), Turkey, Pepperoni",113.398,70.0,3.0,10.0,0.0,3.0,0.5,7.0,1.0,0.0,13.0,250.0,0.0,0.0,0.0,188.0,386.0,15.0,1,,,median_over_topK,5,41,53.20772946859902
KINDERGARTEN PIN USE TRAINING,"DO NOT USE - Peppers, green, pre-sliced, Chicken, Diced (DO NOT USE), DO NOT USE Peppers, red, pre-sliced",62.3689,35.0,2.0,3.0,1.0,1.0,0.0,2.0,0.0,0.0,0.0,130.0,0.0,6.0,0.0,109.0,231.0,50.0,1,,,median_over_topK,5,36,85.33014074121236
THANKSGIVING ADULT LUNCH SECONDARY,"Egg and Cheese Burrito - For Lunch, Tangerine Whole, Vanilla Sugar Cookie",120.3495,185.0,15.0,15.0,2.0,6.0,3.5,7.0,1.0,0.0,21.0,434.0,0.0,35.0,1.0,188.0,772.0,30.0,1,,,median_over_topK,5,9,138.3612626884938
HAMBURGER SECONDARY,"Hamburger, Bread, Hamburger Bun, Tangerine Whole",120.3495,185.0,17.0,27.0,4.0,8.0,3.0,8.0,2.0,0.0,45.0,410.0,0.0,110.0,1.0,188.0,0.0,0.0,1,,,median_over_topK,5,7,31.673844589176397
THANKSGIVING ADULT LUNCH ELEMENTARY,"Egg and Cheese Burrito - For Lunch, Tangerine Whole, Vanilla Sugar Cookie",120.3495,185.0,15.0,15.0,2.0,6.0,3.5,7.0,1.0,0.0,21.0,434.0,0.0,35.0,1.0,188.0,772.0,30.0,1,,,median_over_topK,5,4,138.3612626884938
PBJ MEAL SECONDARY,"Cereal, Cinnamon Toasters, Malt-O-Meal, IW (Sub), Tangerine Whole, Pasta, Baked Penne",120.3495,185.0,17.0,23.0,2.0,8.0,2.0,7.0,1.0,0.0,48.0,434.0,0.0,38.5,2.0,373.0,772.0,30.0,1,,,median_over_topK,5,1,155.47004531300257
ELEMENTARY,"Tangerine Whole, Dressing, Ranch, Bulk, Lite (NEW), Turkey, Pepperoni",113.398,70.0,3.0,10.0,0.0,3.0,0.5,7.0,1.0,0.0,13.0,250.0,0.0,0.0,0.0,188.0,386.0,15.0,1,,,median_over_topK,5,0,53.20772946859902
CHEESE STIX -1 ELEMENTARY,"Cheese Sticks, Baked (Warehouse - effective 9/1), Cream Cheese, Calzone, Cheese",120.135875,261.0,16.0,29.0,3.0,4.0,2.0,9.0,4.0,0.0,30.0,640.0,0.0,261.0,2.0,147.0,0.0,0.0,1,,,median_over_topK,5,0,25.166952343737975
"$1.25 CHIPS 1,011","Tortilla Chips, RF Kettle Chips Jalapeno & Cheddar Chips, Doritos Wild White Nacho Flavored Tortilla Chips",39.12231,134.0,2.0,19.5,1.5,0.0,0.0,5.5,1.0,0.0,0.0,122.0,0.0,40.0,0.0,54.5,,,0,,,median_over_topK,5,0,202.22734422693037
